{
  "$schema": "./phase-0-baseline.schema.json",
  "version": 1,
  "capturedAt": "2026-07-25",
  "runtimeInventory": [
    {
      "id": "main-agent-provider-loop",
      "path": "packages/core/src/agent/SocratesAgent.ts",
      "anchors": ["export class SocratesAgent", "this.runtime.run", "this.turnLifecycle.runPostEvidenceMemoryLoop"],
      "finding": "Classic, Flow, and Skill Writer retain one Socrates lifecycle while all provider execution enters through AgentRuntime."
    },
    {
      "id": "structured-worker-provider-loop",
      "path": "packages/core/src/agent/AgentRuntime.ts",
      "anchors": ["export class AgentRuntime", "input.provider.stream", "input.provider.generateStructured"],
      "finding": "Main model steps, text workers, and structured workers share the one public provider-neutral AgentRuntime boundary."
    },
    {
      "id": "flow-goal-router-empty-tools",
      "path": "packages/core/src/tools/registry.ts",
      "anchors": ["createGoalRouterToolRegistry", "new ToolRegistry([goalSearchTool])"],
      "finding": "The shared Goal Router has one bounded read-only goal_search tool; runtime execution caps it at three calls."
    },
    {
      "id": "flow-goal-router-context-shape",
      "path": "packages/core/src/prompts/goalRouterPrompt.ts",
      "anchors": ["immediatelyPrecedingExchanges", "selectedGoalHistory", "currentCandidate", "candidates:"],
      "finding": "The router receives the full latest request, three immediately preceding visible Q&A pairs, five selected-goal Q&A pairs, and bounded goal cards."
    },
    {
      "id": "validated-main-answer-owns-finalization",
      "path": "packages/core/src/agent/SocratesAgent.ts",
      "anchors": ["socratesFinalAnswerSchema", "type: \"agent.final_result\"", "finalAnswerMode === \"structured\""],
      "finding": "The main Socrates turn emits one validated answer and goal-finalization result after reconciliation; the detached post router is no longer a completion authority."
    },
    {
      "id": "focus-ledger-second-completion-authority",
      "path": "apps/server/src/services/v2/flowStore.ts",
      "anchors": ["input.request.operation === \"complete_current\"", "Completion is staged and will commit after the final response is saved."],
      "finding": "Flow also permits the main model to stage completion through focus_ledger."
    },
    {
      "id": "completion-selects-general",
      "path": "apps/server/src/services/v2/flowStore.ts",
      "anchors": ["Lifecycle and view selection are deliberately independent", "remain selected until an explicit routing"],
      "finding": "Validated completion changes goal lifecycle without changing the selected Flow goal."
    },
    {
      "id": "canonical-cross-view-projections",
      "path": "apps/server/src/services/workState/canonicalWorkStore.ts",
      "anchors": ["export class CanonicalWorkStore", "listFlowMessages", "listConversationMessages", "reconcileLegacyBridgeData"],
      "finding": "Classic and Flow now resolve canonical task/message identities to their physical source rows; view navigation stores references and legacy copied rows remain only as non-authoritative rollback data."
    },
    {
      "id": "direct-soul-provider-call",
      "path": "packages/core/src/agent/SoulConfirmationAgent.ts",
      "anchors": ["export class SoulConfirmationAgent", "new AgentRuntime()", "soulConfirmationAgentOutputSchema"],
      "finding": "Soul confirmation is a strict no-tool agent using the same AgentRuntime boundary."
    },
    {
      "id": "flow-live-activity-presentation",
      "path": "apps/server/src/v2/liveActivity.ts",
      "anchors": [
        "export const v2ToolActivity",
        "export const fallbackV2LiveActivity",
        "Working with the project tools"
      ],
      "finding": "The server owns one typed, bounded, privacy-safe live activity sentence; the Flow client replaces that single slot instead of deriving or stacking raw tool state."
    }
  ],
  "scenarios": [
    {
      "id": "native-invalid-tool-input-recovers",
      "observed": "trace_retrieve with an empty object and search with unsupported contextLines were persisted as invalid_tool_input; the turn continued.",
      "turns": [
        { "role": "runtime", "content": "trace_retrieve({}) -> invalid_tool_input" },
        { "role": "runtime", "content": "search({ query, contextLines }) -> invalid_tool_input" }
      ],
      "targetInvariant": "A malformed native tool call is visible as a failed call, gives bounded corrective feedback, and does not corrupt the final answer.",
      "ownerPhase": 1,
      "status": "passing",
      "futureTestSurface": "shared AgentRuntime tool normalization and Flow runtime persistence"
    },
    {
      "id": "plaintext-tool-envelope-is-not-an-answer",
      "observed": "A DSML-like tool envelope emitted as plain text during the no-tools final step was accepted and persisted as the answer.",
      "turns": [
        { "role": "assistant", "content": "<DSML><tool_calls><invoke name=\"search\">...</invoke></tool_calls></DSML>" }
      ],
      "targetInvariant": "Malformed tool envelopes, internal control text, and empty prose fail final-answer integrity validation and cannot complete a goal.",
      "ownerPhase": 1,
      "status": "passing",
      "futureTestSurface": "structured main final result and answer integrity gate"
    },
    {
      "id": "short-followup-preserves-meaning",
      "observed": "After the malformed answer, the user asked what???? and Socrates explained an invented internal runtime dump instead of answering the original review request.",
      "turns": [
        { "role": "user", "content": "Review Flow mode and its connection with Classic View." },
        { "role": "assistant", "content": "I have a thorough picture... <DSML tool envelope>" },
        { "role": "user", "content": "what????" },
        { "role": "assistant", "content": "It looks like internal Socrates runtime context was dumped..." },
        { "role": "user", "content": "No, tell me what you found out." }
      ],
      "targetInvariant": "A short repair or clarification stays attached to the preceding task and receives enough uncorrupted exchange context to answer what the user meant.",
      "ownerPhase": 2,
      "status": "passing",
      "futureTestSurface": "Flow goal routing and working-message assembly"
    },
    {
      "id": "completion-does-not-deselect-goal",
      "observed": "The completed review focus was replaced by General Conversation in Current Focus, including while viewing the historical query.",
      "turns": [
        { "role": "user", "content": "Check how the focus ledger is built." },
        { "role": "assistant", "content": "The inspection is complete." }
      ],
      "targetInvariant": "Goal lifecycle status and selectedGoal are independent; completion retains the goal on screen and historical queries show their bound goal.",
      "ownerPhase": 2,
      "status": "passing",
      "futureTestSurface": "canonical focus state, Flow store, API snapshot, and Flow UI"
    },
    {
      "id": "meaningful-followup-reopens-same-goal",
      "observed": "The current router/store model can treat a completed answer as the end of the focus even when the next request directly extends that work.",
      "turns": [
        { "role": "user", "content": "Check how the focus ledger is built." },
        { "role": "assistant", "content": "The inspection is complete." },
        { "role": "user", "content": "Now update the focus ledger by adding this information." }
      ],
      "targetInvariant": "The completed goal is reopened and expanded with a new task instead of creating a disconnected goal.",
      "ownerPhase": 2,
      "status": "passing",
      "futureTestSurface": "Classic and Flow routers against one canonical goal/task store"
    },
    {
      "id": "related-new-goal-has-transition-context",
      "observed": "Flow context can isolate the latest goal so aggressively that an adjacent transition must be reconstructed through retrieval.",
      "turns": [
        { "role": "user", "content": "Review the memory ledger." },
        { "role": "assistant", "content": "The verified memory-ledger outcome is..." },
        { "role": "user", "content": "Great, now let's move to trace retrieve." }
      ],
      "targetInvariant": "A genuinely new goal receives a bounded transition bridge containing the immediately preceding exchange and verified prior-goal outcome.",
      "ownerPhase": 2,
      "status": "passing",
      "futureTestSurface": "Flow context assembler"
    },
    {
      "id": "classic-flow-roundtrip-does-not-copy-qna",
      "observed": "The released bridge mirrors and imports view-specific message rows with different ids.",
      "turns": [
        { "role": "user", "content": "Open this Classic work in Flow, continue it, then return to Classic." }
      ],
      "targetInvariant": "Both views project the same canonical turns, tools, evidence, task state, and continuation without replacement Q&A copies.",
      "ownerPhase": 3,
      "status": "passing",
      "futureTestSurface": "canonical persistence migration and cross-view API contracts"
    },
    {
      "id": "single-live-activity-line",
      "observed": "The server emits one typed bounded activity value, the reducer replaces that value in one slot, and Flow withholds provisional answer text until the durable final message arrives.",
      "turns": [
        { "role": "runtime", "content": "Finding the right focus -> Searching the tool registry -> Reading traceRetrieveTool.ts -> Preparing the answer" }
      ],
      "targetInvariant": "Exactly one bounded runtime-authored activity sentence is replaced in place beneath the orb; it never accumulates into a list.",
      "ownerPhase": 4,
      "status": "passing",
      "futureTestSurface": "apps/server/src/v2/liveActivity.test.ts, apps/web/src/lib/v2/flowState.test.ts, and responsive browser UI"
    }
  ]
}
